SomaFM: Sonic Universe,http://somafm.com/sonicuniverse.pls,"Transcending the world of jazz with eclectic, avant-garde takes on tradition."
SomaFM: Suburbs of Goa,http://somafm.com/suburbsofgoa.pls,Desi-influenced Asian world beats and beyond.
SomaFM: Beat Blender,http://somafm.com/beatblender.pls,A late night blend of deep-house and downtempo chill.
SomaFM: The Trip,http://somafm.com/thetrip.pls,Progressive house / trance. Tip top tunes.
SomaFM: ThistleRadio,http://somafm.com/thistle.pls,Exploring music from Celtic roots and branches
SomaFM: Folk Forward,http://somafm.com/folkfwd.pls,"Indie Folk, Alt-folk and the occasional folk classics."
SomaFM: Boot Liquor,http://somafm.com/bootliquor.pls,"Americana Roots music for Cowhands, Cowpokes and Cowtippers"
SomaFM: Digitalis,http://somafm.com/digitalis.pls,Digitally affected analog rock to calm the agitated heart.
SomaFM: Illinois Street Lounge,http://somafm.com/illstreet.pls,"Classic bachelor pad, playful exotica and vintage music of tomorrow."
SomaFM: Seven Inch Soul,http://somafm.com/7soul.pls,Vintage soul tracks from the original 45 RPM vinyl.
SomaFM: Left Coast 70s,http://somafm.com/seventies.pls,NEW! Mellow album rock from the Seventies. Yacht friendly.
SomaFM: Underground 80s,http://somafm.com/u80s.pls,Early 80s UK Synthpop and a bit of New Wave.
SomaFM: The Silent Channel,http://somafm.com/silent.pls,Light and dark ambient electronic music for exploring inner worlds from Silent Records.
SomaFM: Drone Zone,http://somafm.com/dronezone.pls,"Served best chilled, safe with most medications. Atmospheric textures with minimal beats."
SomaFM: Space Station Soma,http://somafm.com/spacestation.pls,"Tune in, turn on, space out. Spaced-out ambient and mid-tempo electronica."
SomaFM: DEF CON Radio,http://somafm.com/defcon.pls,Music for Hacking. The DEF CON Year-Round Channel.
SomaFM: Groove Salad,http://somafm.com/groovesalad.pls,A nicely chilled plate of ambient/downtempo beats and grooves.
SomaFM: Secret Agent,http://somafm.com/secretagent.pls,"The soundtrack for your stylish, mysterious, dangerous life. For Spies and PIs too!"
SomaFM: Lush,http://somafm.com/lush.pls,"Sensuous and mellow vocals, mostly female, with an electronic influence."
SomaFM: Fluid,http://somafm.com/fluid.pls,"NEW! Drown in the electronic sound of instrumental hiphop, future soul and liquid trap."
SomaFM: Deep Space One,http://somafm.com/deepspaceone.pls,"Deep ambient electronic, experimental and space music. For inner and outer space exploration."
SomaFM: Mission Control,http://somafm.com/missioncontrol.pls,Celebrating NASA and Space Explorers everywhere.
SomaFM: SF 10-33,http://somafm.com/sf1033.pls,Ambient music mixed with the sounds of San Francisco public safety radio traffic.
SomaFM: Dub Step Beyond,http://somafm.com/dubstep.pls,"Dubstep, Dub and Deep Bass. May damage speakers at high volume."
SomaFM: cliqhop idm,http://somafm.com/cliqhop.pls,Blips'n'beeps backed mostly w/beats. Intelligent Dance Music.
SomaFM: PopTron,http://somafm.com/poptron.pls,Electropop and indie dance rock with sparkle and pop.
SomaFM: Indie Pop Rocks!,http://somafm.com/indiepop.pls,New and classic favorite indie pop tracks.
SomaFM: BAGeL Radio,http://somafm.com/bagel.pls,What alternative rock radio should sound like.
SomaFM: Metal Detector,http://somafm.com/metal.pls,"NEW! From black to doom, prog to sludge, thrash to post, stoner to crossover, punk to industrial."
SomaFM: Earwaves,http://somafm.com/earwaves.pls,Spanning the history of electronic and experimental music from the early pioneers to the latest innovators.
SomaFM: Covers,http://somafm.com/covers.pls,Just covers. Songs you know by artists you don't. We've got you covered.
SomaFM: Doomed,http://somafm.com/doomed.pls,Dark industrial/ambient music for tortured souls.
SomaFM: Black Rock FM,http://somafm.com/brfm.pls,"From the Playa to the world, for the annual Burning Man festival."
SomaFM: Xmas in Frisko,http://somafm.com/xmasinfrisko.pls,SomaFM's wacky and eclectic holiday mix. Not for the easily offended.
SomaFM: Christmas Lounge,http://somafm.com/christmas.pls,Chilled holiday grooves and classic winter lounge tracks. (Kid and Parent safe!)
SomaFM: Christmas Rocks!,http://somafm.com/xmasrocks.pls,Have your self an indie/alternative holiday season!
SomaFM: Jolly Ol' Soul,http://somafm.com/jollysoul.pls,Where we cut right to the soul of the season.
DUBSTEP.FM,https://www.dubstep.fm/listen.pls,Dubstep
DUBLAB,http://dublab.com/streams/dubstream.m3u,Beat music
DNBRADIO,https://dnbradio.com/hi.m3u,Drum'n Bass
DrumandBass.FM,http://radio.drumandbass.fm/listen128.m3u,"DRUM AND BASS, LIQUID, JUMP UP, NEUROFUNK WEBRADIO"
TRAP.FM,http://radio.trap.fm/listen128.m3u,"TRAP, TWERK, HIP HOP, DANCEHALL, JERSEYCLUB, HYBRID WEBRADIO"
teKnoradio.nl,http://audio.teknoradio.nl:8064/listen.pls,"Hardtek, Tribe"
HARDCORERADIO,http://www.hardcoreradio.nl/hr.m3u,Hardcore
Originuk.net,http://149.255.59.162:8030/;,Oldskool hardcore
Chilltrax,http://server1.chilltrax.com:9000/listen.pls,Chill out
ROOTS LEGACY,http://www.rootslegacy.fr:8080/listen.pls,Roots rub
かつしかFM,http://hdv3.nkansai.tv/katsushika,
エフエム戸塚,http://hdv3.nkansai.tv/totsuka,
すまいるエフエム,http://hdv.nkansai.tv/smile,
FMいわき,http://hdv2.nkansai.tv/seawave,
エフエム会津,http://hdv3.nkansai.tv/aizu,
エフエムゆーとぴあ,http://hdv3.nkansai.tv/yutopia,秋田県湯沢市
fmさくだいら,http://hdv.nkansai.tv/sakudaira,長野県佐久市
FM Kento,http://hdv.nkansai.tv/kento,新潟県新潟市
エフエム宝塚,http://hdv3.nkansai.tv/takarazuka,
エフエムあまがさき,http://hdv.nkansai.tv/aiai,
えふえむ草津,http://hdv.nkansai.tv/rockets785,
さくらFM,http://hdv.nkansai.tv/sakura,兵庫県西宮市
オキラジ,http://hdv.nkansai.tv/okiradi,沖縄県
FMレキオ,http://hdv4.nkansai.tv/lequio,那覇市おもろまち
FMニライ,http://hdv3.nkansai.tv/nirai,沖縄県中頭郡
FMうるま,http://hdv.nkansai.tv/fm-uruma,沖縄県うるま市